{
  "$schema": "https://json-schema.org/draft/2020-12/schema",
  "$id": "https://sessionreviewer.local/schemas/review-presentation-v4.schema.json",
  "title": "SessionReviewer human review presentation v4",
  "type": "object", "additionalProperties": false,
  "required": ["schema_version", "minimum_reader_version", "minimum_writer_version", "project_id", "generation_id", "project_view_digest", "revision", "current_state", "timeline", "decisions", "risks", "open_loops", "problem_map_revision", "problem_root_ids", "problem_nodes", "chain_dependencies", "human_patches", "orphan_patches", "generated_baselines"],
  "properties": {
    "schema_version": { "const": 4 }, "minimum_reader_version": { "enum": ["0.4.0", "0.4.3"] }, "minimum_writer_version": { "enum": ["0.4.0", "0.4.3"] },
    "project_id": { "$ref": "#/$defs/id" }, "generation_id": { "$ref": "#/$defs/id" }, "project_view_digest": { "$ref": "#/$defs/digest" }, "revision": { "type": "integer", "minimum": 0, "maximum": 9007199254740991 },
    "current_state": { "$ref": "#/$defs/current_state" }, "timeline": { "type": "array", "maxItems": 65536, "items": { "$ref": "#/$defs/timeline" } },
    "decisions": { "type": "array", "maxItems": 65536, "items": { "$ref": "#/$defs/decision" } }, "risks": { "type": "array", "maxItems": 65536, "items": { "$ref": "#/$defs/risk" } }, "open_loops": { "type": "array", "maxItems": 65536, "items": { "$ref": "#/$defs/open_loop" } },
    "problem_map_revision": { "type": "integer", "minimum": 0, "maximum": 9007199254740991 }, "problem_root_ids": { "type": "array", "maxItems": 65536, "items": { "$ref": "#/$defs/id" } },
    "problem_nodes": { "type": "array", "maxItems": 65536, "items": { "$ref": "#/$defs/problem_node" } }, "chain_dependencies": { "type": "array", "maxItems": 65536, "items": { "$ref": "#/$defs/chain_dependency" } },
    "human_patches": { "type": "array", "maxItems": 65536, "items": { "$ref": "#/$defs/patch" } }, "orphan_patches": { "type": "array", "maxItems": 65536, "items": { "$ref": "#/$defs/patch" } }, "generated_baselines": { "type": "array", "maxItems": 65536, "items": { "$ref": "#/$defs/baseline" } }
  },
  "allOf": [
    { "if": { "properties": { "problem_nodes": { "minItems": 1 } }, "required": ["problem_nodes"] }, "then": { "properties": { "problem_map_revision": { "minimum": 1 } } } },
    { "if": { "properties": { "minimum_reader_version": { "const": "0.4.0" } }, "required": ["minimum_reader_version"] }, "then": { "properties": { "minimum_writer_version": { "const": "0.4.0" }, "problem_nodes": { "items": { "properties": { "source_turn_refs": { "items": { "$ref": "#/$defs/legacy_source_turn_ref" } } } } }, "timeline": { "items": { "properties": { "closed_loop": { "properties": { "trigger_question": { "properties": { "source_turn_refs": { "items": { "$ref": "#/$defs/legacy_source_turn_ref" } } } }, "conclusion": { "properties": { "source_turn_refs": { "items": { "$ref": "#/$defs/legacy_source_turn_ref" } } } }, "execution": { "properties": { "source_turn_refs": { "items": { "$ref": "#/$defs/legacy_source_turn_ref" } } } }, "verification": { "properties": { "source_turn_refs": { "items": { "$ref": "#/$defs/legacy_source_turn_ref" } } } }, "impact_and_follow_up": { "properties": { "source_turn_refs": { "items": { "$ref": "#/$defs/legacy_source_turn_ref" } } } }, "source_turn_refs": { "items": { "$ref": "#/$defs/legacy_source_turn_ref" } } } } } } } } }, "else": { "properties": { "minimum_writer_version": { "const": "0.4.3" } } } }
  ],
  "$defs": {
    "id": { "type": "string", "minLength": 1, "maxLength": 256, "pattern": "^[A-Za-z0-9][A-Za-z0-9._:-]*$" }, "text": { "type": "string", "maxLength": 16384 }, "excerpt": { "type": "string", "maxLength": 4096 }, "digest": { "type": "string", "pattern": "^sha256:[0-9a-f]{64}$" }, "sha256": { "type": "string", "pattern": "^[0-9a-f]{64}$" }, "timestamp": { "type": "string", "maxLength": 128 }, "strings": { "type": "array", "maxItems": 256, "items": { "$ref": "#/$defs/text" } },
    "current_state": { "type": "object", "additionalProperties": false, "required": ["goal", "stage", "status", "next_action", "last_verification"], "properties": { "goal": { "$ref": "#/$defs/text" }, "stage": { "$ref": "#/$defs/text" }, "status": { "$ref": "#/$defs/text" }, "next_action": { "$ref": "#/$defs/text" }, "last_verification": { "$ref": "#/$defs/text" } } },
    "source_turn_ref": { "type": "object", "additionalProperties": false, "required": ["provider", "session_id", "turn_unit_id"], "properties": { "provider": { "$ref": "#/$defs/id" }, "session_id": { "$ref": "#/$defs/id" }, "turn_unit_id": { "$ref": "#/$defs/id" }, "session_view_digest": { "$ref": "#/$defs/digest" } } },
    "legacy_source_turn_ref": { "type": "object", "additionalProperties": false, "required": ["provider", "session_id", "turn_unit_id"], "properties": { "provider": { "$ref": "#/$defs/id" }, "session_id": { "$ref": "#/$defs/id" }, "turn_unit_id": { "$ref": "#/$defs/id" } } },
    "source_turn_refs": { "type": "array", "maxItems": 256, "items": { "$ref": "#/$defs/source_turn_ref" } },
    "missing_reason": { "type": ["string", "null"], "enum": ["not_captured", "no_visible_answer", "no_execution_evidence", "not_verified", "source_unavailable", "partial_coverage", null] },
    "closed_loop_segment": { "type": "object", "additionalProperties": false, "required": ["state", "text", "missing_reason", "source_turn_refs"], "properties": { "state": { "enum": ["present", "partial", "missing"] }, "text": { "$ref": "#/$defs/text" }, "missing_reason": { "$ref": "#/$defs/missing_reason" }, "source_turn_refs": { "$ref": "#/$defs/source_turn_refs" } }, "allOf": [{ "if": { "properties": { "state": { "const": "missing" } }, "required": ["state"] }, "then": { "properties": { "text": { "const": "" }, "missing_reason": { "type": "string" } } }, "else": { "properties": { "text": { "type": "string", "minLength": 1 }, "missing_reason": { "const": null } } } }] },
    "closed_loop_conclusion": { "type": "object", "additionalProperties": false, "required": ["kind", "text", "missing_reason", "source_turn_refs"], "properties": { "kind": { "enum": ["visible_answer_excerpt", "human_confirmed", "ai_candidate_confirmed", "missing"] }, "text": { "$ref": "#/$defs/text" }, "missing_reason": { "$ref": "#/$defs/missing_reason" }, "source_turn_refs": { "$ref": "#/$defs/source_turn_refs" } }, "allOf": [{ "if": { "properties": { "kind": { "const": "missing" } }, "required": ["kind"] }, "then": { "properties": { "text": { "const": "" }, "missing_reason": { "type": "string" } } }, "else": { "properties": { "text": { "type": "string", "minLength": 1 }, "missing_reason": { "const": null } } } }, { "if": { "properties": { "kind": { "const": "visible_answer_excerpt" } }, "required": ["kind"] }, "then": { "properties": { "text": { "type": "string", "maxLength": 4096 } } } }] },
    "closed_loop_coverage": { "type": "object", "additionalProperties": false, "required": ["source_turns", "captured_turns", "truncated_turns", "source_unavailable_turns"], "properties": { "source_turns": { "type": "integer", "minimum": 0, "maximum": 9007199254740991 }, "captured_turns": { "type": "integer", "minimum": 0, "maximum": 9007199254740991 }, "truncated_turns": { "type": "integer", "minimum": 0, "maximum": 9007199254740991 }, "source_unavailable_turns": { "type": "integer", "minimum": 0, "maximum": 9007199254740991 } } },
    "closed_loop": { "type": "object", "additionalProperties": false, "required": ["trigger_question", "conclusion", "execution", "verification", "impact_and_follow_up", "source_turn_refs", "coverage"], "properties": { "trigger_question": { "$ref": "#/$defs/closed_loop_segment" }, "conclusion": { "$ref": "#/$defs/closed_loop_conclusion" }, "execution": { "$ref": "#/$defs/closed_loop_segment" }, "verification": { "$ref": "#/$defs/closed_loop_segment" }, "impact_and_follow_up": { "$ref": "#/$defs/closed_loop_segment" }, "source_turn_refs": { "$ref": "#/$defs/source_turn_refs" }, "coverage": { "$ref": "#/$defs/closed_loop_coverage" } } },
    "timeline": { "type": "object", "additionalProperties": false, "required": ["id", "generation_id", "occurred_at", "kind", "title", "summary", "decision_ids", "closed_loop"], "properties": { "id": { "$ref": "#/$defs/id" }, "generation_id": { "$ref": "#/$defs/id" }, "occurred_at": { "$ref": "#/$defs/timestamp" }, "kind": { "$ref": "#/$defs/id" }, "title": { "$ref": "#/$defs/text" }, "summary": { "$ref": "#/$defs/text" }, "decision_ids": { "$ref": "#/$defs/id_array" }, "closed_loop": { "$ref": "#/$defs/closed_loop" } } },
    "decision": { "type": "object", "additionalProperties": false, "required": ["id", "kind", "occurred_at", "title", "rationale", "impact", "status", "legacy_status_text", "reevaluate_when", "supersedes", "milestone_ids", "session_refs", "provenance", "pinned", "revision"], "properties": { "id": { "$ref": "#/$defs/id" }, "kind": { "enum": ["decision", "agreement"] }, "occurred_at": { "$ref": "#/$defs/timestamp" }, "title": { "$ref": "#/$defs/text" }, "rationale": { "$ref": "#/$defs/text" }, "impact": { "$ref": "#/$defs/text" }, "status": { "enum": ["active", "superseded", "archived", "legacy_unmapped"] }, "legacy_status_text": { "type": ["string", "null"], "maxLength": 16384 }, "reevaluate_when": { "$ref": "#/$defs/text" }, "supersedes": { "$ref": "#/$defs/id_array" }, "milestone_ids": { "$ref": "#/$defs/id_array" }, "session_refs": { "type": "array", "maxItems": 256, "items": { "$ref": "#/$defs/session_ref" } }, "provenance": { "enum": ["human_created", "migrated", "ai_candidate_confirmed"] }, "pinned": { "type": "boolean" }, "revision": { "type": "integer", "minimum": 1, "maximum": 9007199254740991 } }, "allOf": [{ "if": { "properties": { "status": { "const": "legacy_unmapped" } }, "required": ["status"] }, "then": { "properties": { "legacy_status_text": { "type": "string" }, "provenance": { "const": "migrated" } } }, "else": { "properties": { "legacy_status_text": { "type": "null" } } } }] },
    "session_ref": { "type": "object", "additionalProperties": false, "required": ["provider", "session_id"], "properties": { "provider": { "$ref": "#/$defs/id" }, "session_id": { "$ref": "#/$defs/id" } } },
    "risk": { "type": "object", "additionalProperties": false, "required": ["id", "title", "status", "detail"], "properties": { "id": { "$ref": "#/$defs/id" }, "title": { "$ref": "#/$defs/text" }, "status": { "$ref": "#/$defs/text" }, "detail": { "$ref": "#/$defs/text" } } },
    "open_loop": { "type": "object", "additionalProperties": false, "required": ["id", "title", "status", "question", "next_experiment", "completion_criterion"], "properties": { "id": { "$ref": "#/$defs/id" }, "title": { "$ref": "#/$defs/text" }, "status": { "$ref": "#/$defs/text" }, "question": { "$ref": "#/$defs/text" }, "next_experiment": { "$ref": "#/$defs/text" }, "completion_criterion": { "$ref": "#/$defs/text" } } },
    "problem_node": { "type": "object", "additionalProperties": false, "required": ["id", "question", "primary_parent_id", "related_node_ids", "workflow_state", "answer_state", "completion_criterion", "current_conclusion", "source_turn_refs", "provenance", "first_proposed_at", "sibling_order", "confirmed_at", "revision"], "properties": { "id": { "$ref": "#/$defs/id" }, "question": { "$ref": "#/$defs/excerpt" }, "primary_parent_id": { "type": ["string", "null"], "minLength": 1, "maxLength": 256, "pattern": "^[A-Za-z0-9][A-Za-z0-9._:-]*$" }, "related_node_ids": { "type": "array", "maxItems": 2, "items": { "$ref": "#/$defs/id" } }, "workflow_state": { "enum": ["not_started", "in_progress", "paused", "resolved"] }, "answer_state": { "enum": ["no_answer", "answered_unverified", "execution_verified"] }, "completion_criterion": { "$ref": "#/$defs/text" }, "current_conclusion": { "$ref": "#/$defs/text" }, "source_turn_refs": { "$ref": "#/$defs/source_turn_refs" }, "provenance": { "enum": ["human_created", "migrated", "candidate_confirmed"] }, "first_proposed_at": { "$ref": "#/$defs/timestamp" }, "sibling_order": { "type": "integer", "minimum": 0, "maximum": 9007199254740991 }, "confirmed_at": { "type": ["string", "null"], "maxLength": 128 }, "revision": { "type": "integer", "minimum": 1, "maximum": 9007199254740991 } } },
    "chain_dependency": { "type": "object", "additionalProperties": false, "required": ["provider", "session_id", "session_view_digest", "dependency_digest", "turn_unit_ids"], "properties": { "provider": { "$ref": "#/$defs/id" }, "session_id": { "$ref": "#/$defs/id" }, "session_view_digest": { "$ref": "#/$defs/digest" }, "dependency_digest": { "$ref": "#/$defs/digest" }, "turn_unit_ids": { "type": "array", "maxItems": 65536, "items": { "$ref": "#/$defs/id" } } } },
    "patch": { "type": "object", "additionalProperties": false, "required": ["entity_id", "field", "operation", "base_generated_hash"], "properties": { "entity_id": { "$ref": "#/$defs/id" }, "field": { "$ref": "#/$defs/id" }, "operation": { "enum": ["set", "suppress", "restore_default"] }, "value": { "$ref": "#/$defs/text" }, "values": { "$ref": "#/$defs/strings" }, "base_generated_hash": { "$ref": "#/$defs/sha256" } } },
    "baseline": { "type": "object", "additionalProperties": false, "required": ["generation_id", "entity_id", "field", "kind", "generated_hash"], "properties": { "generation_id": { "$ref": "#/$defs/id" }, "entity_id": { "$ref": "#/$defs/id" }, "field": { "$ref": "#/$defs/id" }, "kind": { "$ref": "#/$defs/id" }, "value": { "$ref": "#/$defs/text" }, "values": { "$ref": "#/$defs/strings" }, "generated_hash": { "$ref": "#/$defs/sha256" } } },
    "id_array": { "type": "array", "maxItems": 256, "items": { "$ref": "#/$defs/id" } }
  }
}
